{"adapter_id":"v2:adapter:sha256:73e4457e3b845a2964cd22110841e59bf8c87451a30e85e3f74e124792cd10a5","buffers":[{"dtype":"<f8","inverse":[],"logical_bits":61824,"name":"value/000000","shape":[966]},{"dtype":"<f8","inverse":[],"logical_bits":61824,"name":"value/000001","shape":[966]},{"dtype":"<i8","inverse":[],"logical_bits":61824,"name":"value/000002","shape":[966]},{"dtype":"<i8","inverse":[],"logical_bits":61824,"name":"value/000003","shape":[966]},{"dtype":"<i8","inverse":[],"logical_bits":61824,"name":"value/000004","shape":[966]},{"dtype":"<i8","inverse":[],"logical_bits":61824,"name":"value/000005","shape":[966]},{"dtype":"<i8","inverse":[],"logical_bits":61824,"name":"value/000006","shape":[966]}],"canonical_raw_bits":432768,"loss_mode":"LOSSLESS","m":7,"n":966,"parameters":{"block_size":65536,"ei":10,"ej":4,"initial_byte":32,"isa":"SCALAR","native_timing":true},"schema_version":"tscb.decode-context.v1","timestamp_epoch":"UNIX","timestamp_unit":"s","track":"VALUE","value_units":["percent","percent","count","count","count","count","count"]}